{"schema_version":1,"mode":"demo","generated_utc":"2026-10-19T12:00:00Z","as_of_utc":"2026-10-19T12:00:00Z","source":"demo-generator","opportunities":[{"id":"OPP-EURUSD-H1","symbol":"EURUSD","timeframe":"H1","setup":"Liquidity sweep","direction":"SELL","score":72,"score_kind":"heuristic","status":"ARMED","note":"Buy-side sweep 4 candle(s) ago"},{"id":"OPP-GBPJPY-H1","symbol":"GBPJPY","timeframe":"H1","setup":"Liquidity sweep","direction":"BUY","score":68,"score_kind":"heuristic","status":"ARMED","note":"Sell-side sweep 5 candle(s) ago"},{"id":"OPP-EURUSD-M5","symbol":"EURUSD","timeframe":"M5","setup":"Testing resistance","direction":"SELL","score":65,"score_kind":"heuristic","status":"WATCH","note":"3 touches, 0.02 ATR away"},{"id":"OPP-XAUUSD-M5","symbol":"XAUUSD","timeframe":"M5","setup":"Liquidity sweep","direction":"SELL","score":60,"score_kind":"heuristic","status":"ARMED","note":"Buy-side sweep 1 candle(s) ago"},{"id":"OPP-EURUSD-M15","symbol":"EURUSD","timeframe":"M15","setup":"Liquidity sweep","direction":"BUY","score":60,"score_kind":"heuristic","status":"ARMED","note":"Sell-side sweep 1 candle(s) ago"},{"id":"OPP-XAUUSD-H1","symbol":"XAUUSD","timeframe":"H1","setup":"Liquidity sweep","direction":"SELL","score":59,"score_kind":"heuristic","status":"ARMED","note":"Buy-side sweep 3 candle(s) ago"},{"id":"OPP-XAUUSD-M15","symbol":"XAUUSD","timeframe":"M15","setup":"Testing support","direction":"BUY","score":58,"score_kind":"heuristic","status":"WATCH","note":"2 touches, 0.04 ATR away"},{"id":"OPP-GBPUSD-M15","symbol":"GBPUSD","timeframe":"M15","setup":"Trend continuation","direction":"BUY","score":55,"score_kind":"heuristic","status":"WATCH","note":"HH/LL, strength 100%"},{"id":"OPP-GBPJPY-M15","symbol":"GBPJPY","timeframe":"M15","setup":"Trend continuation","direction":"BUY","score":55,"score_kind":"heuristic","status":"WATCH","note":"HH/HL, strength 100%"},{"id":"OPP-GBPUSD-H1","symbol":"GBPUSD","timeframe":"H1","setup":"Trend continuation","direction":"BUY","score":41,"score_kind":"heuristic","status":"WATCH","note":"LH/LL, strength 53%"}]}
